{
  "$schema": "https://json-schema.org/draft/2020-12/schema",
  "$id": "https://ophiolite.dev/contracts/assets/v1/wavelet-schema.json",
  "x-ophiolite": {
    "id": "ophiolite.wavelet/1",
    "version": "1.0.0",
    "lifecycle": "preview"
  },
  "$defs": {
    "Fidelity": {
      "additionalProperties": false,
      "properties": {
        "status": {
          "const": "assessed",
          "title": "Status",
          "type": "string"
        },
        "preserved": {
          "items": {
            "maxLength": 512,
            "minLength": 1,
            "type": "string"
          },
          "maxItems": 16,
          "title": "Preserved",
          "type": "array"
        },
        "losses": {
          "items": {
            "maxLength": 512,
            "minLength": 1,
            "type": "string"
          },
          "maxItems": 16,
          "title": "Losses",
          "type": "array"
        },
        "unknown_context": {
          "items": {
            "maxLength": 128,
            "minLength": 1,
            "type": "string"
          },
          "maxItems": 16,
          "title": "Unknown Context",
          "type": "array"
        },
        "decisions": {
          "anyOf": [
            {
              "items": {
                "maxLength": 512,
                "minLength": 1,
                "type": "string"
              },
              "maxItems": 64,
              "type": "array"
            },
            {
              "type": "null"
            }
          ],
          "default": null,
          "title": "Decisions"
        }
      },
      "required": [
        "status",
        "preserved",
        "losses",
        "unknown_context"
      ],
      "title": "Fidelity",
      "type": "object"
    },
    "Reference": {
      "additionalProperties": false,
      "properties": {
        "authority": {
          "maxLength": 512,
          "minLength": 1,
          "title": "Authority",
          "type": "string"
        },
        "key": {
          "maxLength": 512,
          "minLength": 1,
          "title": "Key",
          "type": "string"
        },
        "revision": {
          "maxLength": 512,
          "minLength": 1,
          "title": "Revision",
          "type": "string"
        },
        "profile": {
          "maxLength": 128,
          "pattern": "^[a-z0-9][a-z0-9.-]*(/[a-z0-9.-]+)*/[0-9]+$",
          "title": "Profile",
          "type": "string"
        }
      },
      "required": [
        "authority",
        "key",
        "revision",
        "profile"
      ],
      "title": "Reference",
      "type": "object"
    },
    "TypedInterpretation": {
      "additionalProperties": false,
      "description": "The executable identity of the typed reader (Connectors typed_reader; E56: feature_files for feature sets).",
      "properties": {
        "reader": {
          "enum": [
            "asset_connectors.typed_reader/1",
            "asset_connectors.feature_files/1"
          ],
          "title": "Reader",
          "type": "string"
        },
        "mapping": {
          "enum": [
            "well-tops/1",
            "trajectory/1",
            "regular-grid-surface/1",
            "triangulated-surface/1",
            "point-set/1",
            "polyline-set/1",
            "seismic-volume/1",
            "well-location/1",
            "wavelet/1",
            "model-section/1",
            "seismic-section/1",
            "time-depth/1",
            "feature-set/1",
            "well-path/1",
            "well-set/1",
            "well-residual/1"
          ],
          "title": "Mapping",
          "type": "string"
        },
        "parsing_policy": {
          "const": "typed-strict/1",
          "title": "Parsing Policy",
          "type": "string"
        },
        "null_policy": {
          "maxLength": 512,
          "minLength": 1,
          "title": "Null Policy",
          "type": "string"
        }
      },
      "required": [
        "reader",
        "mapping",
        "parsing_policy",
        "null_policy"
      ],
      "title": "TypedInterpretation",
      "type": "object"
    },
    "WaveletContext": {
      "additionalProperties": false,
      "properties": {
        "type": {
          "const": "wavelet",
          "title": "Type",
          "type": "string"
        },
        "kind": {
          "enum": [
            "ricker",
            "ormsby",
            "other"
          ],
          "title": "Kind",
          "type": "string"
        },
        "frequency_hz": {
          "anyOf": [
            {
              "exclusiveMinimum": 0,
              "type": "number"
            },
            {
              "type": "null"
            }
          ],
          "title": "Frequency Hz"
        },
        "corners_hz": {
          "anyOf": [
            {
              "items": {
                "type": "number"
              },
              "maxItems": 4,
              "minItems": 4,
              "type": "array"
            },
            {
              "type": "null"
            }
          ],
          "title": "Corners Hz"
        },
        "dt": {
          "maximum": 0.01,
          "minimum": 0.0005,
          "title": "Dt",
          "type": "number"
        },
        "t0": {
          "title": "T0",
          "type": "number"
        },
        "time_unit": {
          "const": "s",
          "title": "Time Unit",
          "type": "string"
        },
        "polarity": {
          "enum": [
            "impedance-increase-positive",
            "impedance-increase-negative",
            "unknown"
          ],
          "title": "Polarity",
          "type": "string"
        },
        "sample_count": {
          "maximum": 4095,
          "minimum": 3,
          "title": "Sample Count",
          "type": "integer"
        },
        "minimum": {
          "title": "Minimum",
          "type": "number"
        },
        "maximum": {
          "title": "Maximum",
          "type": "number"
        },
        "fidelity": {
          "$ref": "#/$defs/Fidelity"
        }
      },
      "required": [
        "type",
        "kind",
        "frequency_hz",
        "corners_hz",
        "dt",
        "t0",
        "time_unit",
        "polarity",
        "sample_count",
        "minimum",
        "maximum",
        "fidelity"
      ],
      "title": "WaveletContext",
      "type": "object"
    }
  },
  "additionalProperties": false,
  "description": "E53: every sample in file order with the declared kind, frequencies, interval, first time and polarity.",
  "properties": {
    "representation": {
      "const": "normalized",
      "title": "Representation",
      "type": "string"
    },
    "source": {
      "$ref": "#/$defs/Reference"
    },
    "source_sha256": {
      "pattern": "^[0-9a-f]{64}$",
      "title": "Source Sha256",
      "type": "string"
    },
    "interpretation": {
      "$ref": "#/$defs/TypedInterpretation"
    },
    "schema": {
      "const": "ophiolite.wavelet/1",
      "title": "Schema",
      "type": "string"
    },
    "context": {
      "$ref": "#/$defs/WaveletContext"
    },
    "samples": {
      "items": {
        "type": "number"
      },
      "maxItems": 4095,
      "minItems": 3,
      "title": "Samples",
      "type": "array"
    }
  },
  "required": [
    "representation",
    "source",
    "source_sha256",
    "interpretation",
    "schema",
    "context",
    "samples"
  ],
  "title": "Wavelet",
  "type": "object"
}
